Service Description,Service Classification
"The Loans API allows you to see if the client has a pre-approved loan available with BBVA, the conditions attached to the loan and whether to accept, with just one click. It allows third party applications to retrieve the following information of a BBVA user Pre-approved loan for consumption installments and amounts. The BBVA API Market is a platform for global financial services for business.",Banking
The data services specifications for the PayStats API provides statistical transactions data that has been retrieved through BBVA cards or in BBVA point of sale. BBVA PayStats offers anonymized and aggregated statistical data from millions of transactions performed with any cards in BBVA POS terminals. The BBVA API Market is a platform for global financial services for business.,Banking
"The Customers API provides third party applications with information belonging to the BBVA user associated to the OAuth token used to invoke the API and includes; User is unique identifier, Name, Surnames, Gender and more. It allows you to retrieve current key user information that is accurate and updated without endless forms. The BBVA API Market is a platform for global financial services for business.",Banking
The BBVA Authentication protocol offers the a secure way that is approved by BBVA to access API resources by third party enterprises or developers. This protocol supports the OAuth2 Authorization Framework. The BBVA API Market is a platform for global financial services for business.,Banking
"The Intrinio Global Corporate Actions API allows developers to track over 45 types of corporate actions relating to more than 130,000 global securities. Such actions include announcements, annual shareholder meetings, stock splits, stock buy backs, dividend pay dates, bankruptcies, notes, and takeovers. Responses are provided in JSON or CSV format.",Stocks
"The Intrinio Trade Alert Options Prices API allows developers to get both recent and historical time series data on end of day option prices for US stocks going back to 2008. API responses are given in JSON or CSV and include close price, closing big, closing ask, implied volatility, open interest, and a count of trades for all securities.",Stocks
"The AerisWeather Maps Platform provides weather information in graphical form that includes a set of weather layers for past, current and future options, and customization options allowing you to create maps. Aeris Maps uses static maps that you add to a web page, visual display or fully interactive maps for web and mobile users with integration options. AerisWeather provides custom weather solutions that allow you to create your own weather data with Weather API is and developer toolkits.",Weather
The Intrinio Global Public Company Security Master API allows developers to get unique identifiers for securities and companies so that they always know which entity they're dealing with. This is especially useful when working with multiple countries and exchanges where the same security may be identified by multiple symbols. This service also provides basic information about entities and their known aliases.,Stocks
"The Intrinio US Bank & Bank Holding Company API allows developers to access quarterly reports for FDIC-insured banks. This includes filings such as UBPRs, Y-9Cs, and call reports containing information on the banks' assets, debts, and other company information. Users can query full statements or individual items from both historical and recent filings for any US bank.",Banking
"The Intrinio US Institutional Holdings API provides programmatic access to both recent and historic time series data that details institutions' stock holdings. Available information includes the location of the stock-holding business, the number of held shares, the value of those shares, and additional information about the holdings. Responses can be given in JSON or CSV.",Stocks
"The GuruFocus API returns stocks data in JSON formats. It is available in REST architecture with API personal token. With the API, developers can access company financial data, company key statistics data, stock quote data, stock historical price data, and guru financial aggregated data.",Stocks
"The SpaceDog API offers a cloud-based backend which allows businesses to focus on application design, user experience, and more features instead of server and administrative services. Developers can authenticate and authorize users, save and search data, update and push content, and deploy and publish resources. The SpaceDog API uses JSON for responses.",Backend
"This REST API provides standardized and as reported balance sheets, income statements, and statements of cashflow for all publicly traded stocks in the United States. It returns company list and information for all companies covered by Intrinio in Json format. This includes; Companies, Securities, Indices, Securities Search/Screener, Data Point and more. The 10Q and 10K data is available in as-reported and standardized versions, enabling cross equity comparisons even when statement items are not tagged properly. Statements are available back to 2007 and are updated in near real time as they are filed with the SEC (10-30 mins). Historical stock prices (high, low, open, close, volume, and adjusted prices) as well as current intra-day prices are available along with company news. Intrinio is a Fintech Marketplace for financial data feeds and apps.",Stocks
"This REST API provides aggregated financial benchmarks for 500+ United States Sectors and Industries grouped by SIC code. It allows you to view the average, 25th and 75th percentile and mode for data such as P/E, revenue, employee count, EBITDA and hundreds more for industries such as Oil & Gas, Pharmaceuticals, and Technology. This includes pull time series data to view historical financial metrics for any US industry as well as the most recent values to compare a single stock to it's industry peers or to gauge performance across industries. Intrinio is a Fintech Marketplace for financial data feeds and apps.",Stocks
"Insiders at publicly traded companies, such as executives or others with unique knowledge, are required by the SEC to disclose certain purchases/sales of stock. This Rest API tracks those transactions, allowing developers to view the holdings of specific stockholders or the holdings of any insiders at a specific firm. It reports all insider transactions for owners and companies and provides transaction details for both non-derivative and derivative transactions for all owners. Ownership holdings are aggregated by both owners and by companies, with the value of the holdings as of the previous trading day. This data is valuable if you want to monitor the stock trades of individuals with inside information about a company, enabling developers to do so automatically as the filings are made with the SEC. Intrinio is a Fintech Marketplace for financial data feeds and apps.",Stocks
"The deltaDNA API connects a game with an analytics platform which can perform 2 operations: generating unique user IDs, and obtaining triggered events. The API responds in JSON format. deltaDNA is an analytics platform for F2P games, social casino and gambling that features dashboards to tune different games, benchmarks with text cloud analysis, user alerts, direct access to raw data, user defined segmentation, and data mining capabilities.",Analytics
"The Ally API returns banking data. It is available with OAuth authentication and JSON formats, including in addition FIX protocol messages using a standard known as FIXML. REST operations include accounts, balances, and holdings. With the API, developers can write trading and analytics apps via their brokerage account. Ally is a bank that provides digital financial services, including credit card, auto, home loans, and investments.",Banking
"The Dronesmith REST API allows developers to access and integrate the functionality of Dronesmith with other applications. Some example API methods include managing drone objects, retrieving images, and controlling drones. Dronesmith allows users to fly and manage drones through the API.",Internet of Things
"The Hellenic Bank Authentication API can power your app with a robust set of permission-based consumer and business account and transactional data while adhering to bank-level security requirements. Effectively managing data is also key for regulatory reporting. Use the API to authenticate your users easily through your web/desktop and mobile applications. This will enable you to extend reach and attract additional customers. Transactions are performed in a secure manner with the OAuth 2 protocol. Self-register to get started. Testing for your your app is available in Hellenic Bank is sandbox environment. Real-time access on account activity via the Sandbox log. Hellenic Bank offers a platform of financial APIs. Companies or developers interested in using the APIs can register and test them in a sandbox environment. The APIs' openness and modularity allow customers to experiment and innovate. The standards allow them to connect their systems very quickly. Openness to 3rd party solutions (e.g. FinTechs) enables platforms for partnerships and integrated value chains. These APIs all you to: Partner with one of the leading and most innovative banks in Cyprus Unlock new business models with our APIs Secure, reliable and scalable APIs Open APIs available for non-customers of our bank Multi-currency money movements, authentication and account reporting all in one place Start creating using our realistic sandbox environment and quickly test your ideas",Banking
"The Hellenic Bank Account Reporting API will help you get a report and detailed information for any kind of transaction you are making; single or multiple. This API will allow you to view account statements, transaction status, details for each transaction, and view up to date account balances. Integrating this API will allow you to build apps that offer your customers account reconciliation services, personalized finance management and increased insights through detailed transaction analytics. By combining banking analytics with business analytics and understanding spending patterns and trends, financial apps can help businesses better cater to their customers i needs Transactions are performed in a secure manner with the OAuth 2 protocol. Self-register to get started. Testing for your your app is available in Hellenic Bank is sandbox environment. Real-time access on account activity via the Sandbox log. Hellenic Bank offers a platform of financial APIs. Companies or developers interested in using the APIs can register and test them in a sandbox environment. The APIs' openness and modularity allow customers to experiment and innovate. The standards allow them to connect their systems very quickly. Openness to 3rd party solutions (e.g. FinTechs) enables platforms for partnerships and integrated value chains. These APIs all you to: Partner with one of the leading and most innovative banks in Cyprus Unlock new business models with our APIs Secure, reliable and scalable APIs Open APIs available for non-customers of our bank Multi-currency money movements, authentication and account reporting all in one place Start creating using our realistic sandbox environment and quickly test your ideas",Banking
"The Losant REST API allows developers to access and integrate the functionality of Losant with other applications. Some example API methods include managing devices, managing actions, and managing users. Losant is an internet of things platform that helps users develop, build, and manage internet of things solutions.",Internet of Things
"The WXT Weather Service provides atmospheric weather information through a REST architecture, HTTP requests, and JSON formats. It integrates METAR/TAF information, sun, and moon calculations, targeting aviation and energy applications.",Weather
"The Smart Flow Sheet API allows veterinary services providers to track workflows and manage or automate operations in their clinics. It simplifies the integration of both in-patient and outpatient treatment tracking functionalities in clinical apps. The RESTful API returns JSON-formatted responses, and indicates API errors using HTTP response codes.",Medical
"It is an api of local events, you will find events from various places around the world from more than 20 categories, we work very hard to bring you clean and useful data that you could use to validate your business idea or even create your next big thing. Glatsee is personal travel planner available through Facebook chat. Developers can get data returned about events in the following categories: DINING_EVENT, THEATER_DANCE, COMEDY, SPORTS_EVENT, FESTIVAL_EVENT, PARTIES_NIGHTLIFE, NEIGHBORHOOD, MISIC_EVENTS, MUSIC ... Data returned includes Name, Details, Photos, location, interested count, attending count, declined count, category, ticket_url, status, time zone. What will you get? You will get 250 api calls per month for free.",Events
"The GeoSimulator API offers a testing platform for developers that want to integrate geolocation capabilities with their applications. Developers can test arbitrary geofences and random streets when consuming the GeoSimulator REST API. The preferred data exchange format is JSON. Nisos Technologies creates cloud based applications that help non-profit, marketing, advertising, financial and real estate technology providers.",Application Development
"The Hayo API allows developers to build apps that implement virtual remote controls for connected devices in a home. The API senses and transmits events between virtual remote controls and devices, making it easier for users to achieve desired actions on applications by simply manipulating a virtual remote control. The API sends requests and returns responses in JSON format.",Internet of Things
"The Split API is an application deployment platform that offers control over software rollouts with a switchboard for feature flags, targeted rollout plans and integrations. The API is used to build custom implementations, or to integrate it with a preexisting tool. JSON is the preferred data format. Split gives an easier way to deliver specific features to targeted customers.",Application Development
"The Kwik API allows developers to access and integrate the functionality of Kwik with other applications. Public documentation is not available; API access comes with account service. Kwik is an IoT platform that allows brands to connect directly with their customers, enabling repetitive direct-to-consumer purchases.",Internet of Things
"Analyzing the underlying intent associated with any textual data This classifier tells whether the underlying intention behind a sentence is opinion, news, marketing, complaint, suggestion, appreciation, and query. This is trained on our proprietary dataset.",Analytics
"The Cheap Weather API is a standard weather API that is available in free or pay versions, and is cheaper than other options. It is limited in scope as it is only for continental United States and does not provide a maps API. It does provide 3-day/ 3-hour forecasts and forecasts by zip code for all versions; but with the pay versions one can then add geolocation forecast and extended 7-day forecasts.",Weather
"The Eventgrid Customer API allows developers to create order flows for purchasing tickets and seats or to create registrations with sessions. Eventgrid is an event registration and ticketing platform that allows users to create custom, branded online event registration pages and manage their events, attendee access, and ticketing from one portal. Tools for receiving payments and promoting events are also provided.",Events
"Hologram is a provider of connectivity solutions for Internet of Things (IoT) devices. The company is infrastructure consists of the cloud services interface for device data and lifecycle management, the IoT SIM Card for facilitating global cellular network accessibility, and the Hologram Dash pre-certified board for implementing cellular connectivity of devices. The Hologram Dash API supports the integration of Hologram is cellular connectivity capabilities in IoT apps.",Internet of Things
"thethings.iO offers a socket.io server to be able to develop realtime browser apps. The Websocket server only subscribes, so to use authenticate and write, you have to use the REST API. thethings.iO is an enterprise platform and a Internet of Things solution.",Internet of Things
"The Cisco Data in Motion (DMo) API is a data management solution for networked connections such as Internet of Thing (IoT). Designed to be deployed as an inbuilt solution for Cisco-powered products, the RESTful API provides artificial intelligence mechanisms for acquiring and managing data for edge devices. Developers can use the DMo API to integrate real-time data filtering capabilities in edge devices such as sensors.",Internet of Things
"The Cisco IP Interoperability and Collaboration System (IPICS) APIallows developers to deploy programmatic tools and custom applications for managing and controllingoperations parameters for the Cisco IPICS platform. The RESTful API is equipped with functions that support control of various Cisco IPICS operations including VTG creation and user management, among others.",Internet of Things
The Cisco Connected Mobile Experiences (CMX) API combines the use of Wi-Fi and Cisco wireless infrastructure to support the detection and location of mobile devices. The RESTful API is useful for integrating direct mobile content delivery functionality in applications. This makes it easier for users to directly deliver personalized marketing content to smartphones of target audiences in specific locations. The Cisco CMX API transmits requests over the HTTP protocol and returns responses in JSON format.,Internet of Things
The Cisco Flare API simplifies the deployment of a mobile device as an interactive portal for accessing other devices and functional parameters within a particular environment. It is a RESTful API that supports the use of mobile devices to discover gadgets and support connectivity to the operational infrastructure existing in a given environment. The API functionally designed to simultaneously deploy a variety of location technologies alongside real-time communications capabilities to deliver top notch interactive experiences for users.,Internet of Things
The Cisco IOx Metrics API is designed to synchronize the monitoring of data flows and error events across services. The API provides the metrics framework that microservices require to implement mechanisms for accounting for messages and errors within an IOx services ecosystem.,Internet of Things
"The Pendo API integrates data of user behavior in dashboards. It is available in JSON format with API Keys as the authentication factor. With the API, developers can implement feedback, user experience, segmentation, and retroactive analysis. Pendo is a product experience platform that enables software producers to improve user exprience.",Analytics
"The Tiny Stats API offers several web services including email forwarding, SMS updates, and web page traffic analysis. Requests are limited to 1000 per hour, and 100 per minute.The API is free for a week; monthly, quarterly, and yearly plans are available after. Tiny Stats. A simple, intuitive, automated analytics solution.",Analytics
"The Earth Networks Sferic API delivers real-time weather information, hourly forecasts utilizing high accuracy forecast models, and other top-notch weather data. This data and analytical model delivery API provides: Real-time weather for any location Commercial-grade & proprietary data Hourly forecasting Map tiles By partnering with Earth Networks, you'll have the flexibility to use the data in your applications and analytical models. Data requests are made to a REST API, enabling quick and easy integration, and you can choose from a wide range of options based on your volume and specific needs. A free 30-day trail is available here: http://go.earthnetworks.com/sfericapi",Weather
"The Java 9 Stack-Walking API provides a stream of information in stack traces during the execution of a program. The API requires a Virtual Machine to capture a snapshot of the entire stack. This returns an array of elements for filtering purposes, and to remove noise. Developers can skip, drop, and limit the StackFrames with the walk method.",Application Development
The Allthingstalk API provides internet of service features. It is available in REST architecture with JSON data and OAuth2 authentication. It supports Arduino open source platform. AllThingsTalk is an Internet of Things platform for developing IoT products and applications.,Internet of Things
"The Mambu Currencies API retrieves currencies' data for the accounts of an organization. Developers can send HTTP requests to receive JSON responses under REST architecture, previously authenticating with via HTTP basic format. Use the API to access information of type of currency and exchange rate.",Banking
The Mambu Users API retrieves individual and group users by their ID. REST architecture allows performing callbacks by sending HTTP requests and receiving JSON responses. Use the API combined with Custom Fields API to set preferred filters.,Banking
The Mambu Transaction Channels REST API retrieves a list of all transaction channels in the organization via JSON format. Developers can access the interface with HTTP basic auth under a secure HTTPS protocol.,Banking
"The Mambu Document Templates API retrieves document templates data. It is available in REST architecture with HTTP requests, JSON responses, and basic authentication. Use the API to access an ID document by template keys.",Banking
"The Mambu Clients API retrieves, views, stores, creates, and updates clients. Linked data may include their address, custom fields, and identification documents. It is available in REST architecture with JSON format. Use the API to search a client by first name, last name, birth date, id document number, and branch ID.",Banking
"The Mambu Custom Views API retrieves custom views or entities by filter. With the REST interface, developers can authenticate via basic auth to send HTTP requests and receive JSON responses. They can use the API to filter custom views of clients, groups, loans, deposits, and transactions.",Banking
"The Mambu Notifications API integrates messages into banking applications. Under REST architecture, developers can perform callbacks with HTTP and JSON formats, previously authenticating with HTTP basic protocol. Use the API to send a message to a recipient by filtered date.",Banking
The Mambu Images API integrates image retrieval into financial applications. It is available under REST architecture with HTTP requests and JSON responses. Developers can use basic authentication to access the interface via HTTPS. Use the API to obtain images of client's profiles.,Banking
"The Mambu On The Fly API retrieves data with custom filters. HTTP requests are available to return JSON responses. Basic auth under a secure HTTPS is required to authenticate. Use the API to obtain clients, search, transactions, notifications, and journal entries by filtering results.",Banking
"Gain access to current weather data for any location on Earth including over 200,000 cities using the OpenWeatherMap Current Data API. This allows you to; Call current weather data for several cities, Weather parameters and more. OpenWeatherMap provides open weather data, satellite imagery, IoT, and other environmental data for developers.",Weather
"Gain access to hourly historical weather data for cities and historical data from weather stations using the OpenWeatherMap Historical Data API. This allows you to; Call data for History Bulk, Hourly historical data for cities and more. OpenWeatherMap provides open weather data, satellite imagery, IoT, and other environmental data for developers.",Weather
"The OpenWeatherMap Weather Stations API allows you to add and set up your meteorological stations using methods for stations management and measurements transmissions. Some features include; managing your personal weather stations, creation of the station and measurements transfer, receive the aggregated measurements from the station and more. OpenWeatherMap provides open weather data, satellite imagery, IoT, and other environmental data for developers.",Weather
"Gain access to OpenWeatherMap's many kinds of weather maps using the Weather Map Layers API. This includes; Customized weather layers, Precipitation, Sea level pressure, Wind speed and more. OpenWeatherMap provides open weather data, satellite imagery, IoT, and other environmental data for developers.",Weather
"Gain access to OpenWeatherMap's simple syntax and Weather Alerts methods to create triggers which will fire on an occurrence of the selected weather conditions. This includes; temperature, humidity, pressure and more. OpenWeatherMap provides open weather data, satellite imagery, IoT, and other environmental data for developers.",Weather
"This Rest API is a system for Cross-domain Identity Management (SCIM) that aims to simplify user provisioning and management in the cloud. It currently supports SCIM 1.1 and SCIM 2.0. Here are the calls your API should receive from OneLogin SCIM provisioning: Get User, Create User, Get User by ID, Update User and more. OneLogin is an Identity and Access Management (IAM) provider for enterprise in cloud, legacy and hybrid IT environments.",Application Development
The Dojo Toolkit API provides open source modular platforms for developing cross-platform JavaScript applications. The API sends requests and returns responses in JSON or JSONP format.,Application Development
