Service Description,Service Classification
"The GleSYS Cloud VPS (Virtual Private Server) is a flexible, scalable, cloud-based server platform. Users are provided with full root access to their servers and can create or delete servers instantly. The Cloud VPS is flexible enough to handle both IPv4 and IPv6 addresses as well as perform server upgrades and downgrades without needing to restart. The cloud server can be accessed programmatically using REST calls in a variety of data formats. The GleSYS website is provided in both English and Swedish.",Backend
Tambur.io provides backend messaging solutions for mobile and web applications. Developers can build applications and use features such as messaging from Tambur.io in their applications. The Tambur.io API allows developers to access and integrate the functionality of Tabur.io with other applications and create applications. Public documentation is not available; interested developers should sign up here: https://www.tambur.io/.,Backend
"TimeShout is a event database designed to promote local events through sharing capability and visitor participation, all through community input. The service includes calendars, public submissions, event sharing, as well as event booking and registration. The TimeShout API allows users to use REST calls to get events, event lists, get occurrences, get venue information, get profiles, and get calendars. An API key is required with service. The API currently has limited beta functionality open to the public.",Events
"Tick.ee is a free online ticketing sales platform. Sign up for an account with tick.ee and sell tickets on a tick.ee mini-site or straight from your own website. Tick.ee offers features such as scan apps, and is easy to set up. Tick.ee offers a REST API for access to account, ticket and user information. Sample API methods include accounts, events, locations, orders, payment service providers, ticket types, tickets, and users. Authentication is provided via OAuth 2.",Events
"Topoos offers services for developing location based and context-aware applications. Topoos provides all of the pieces and core features that you need so that you can focus your efforts on creating a great app. Services and features include location and proximity, access to geographic information, user authentication, information storage and more. Topoos offers a REST API for programmatic access to their services. An API key is required.",Backend
"BackBeam is a full-stack backend platform for web and mobile developers. Backbeam provides hosted databases, push notifications, a real-time API, personalized emails, statistics, security, user authentication, and more. The backbeam REST API supports JSON and JSONP and uses a custom authorization system similar to OAuth. API keys are required.",Backend
"Cliniko is web-based practice management software that is used by healthcare practitioners around the world. It is accessible from most devices that connect to the internet, including phones, tablets, Macs, and PCs. Cliniko can be used to manage appointments and, if the practitioner wants to, allows patients to book appointments themselves. It also keeps track of treatment notes and financial accounts. Cliniko comes with reporting functions that give an overview of how the practice is doing, and it offers integrations with other specialty applications. The Cliniko API allows users to manage their appointments, businesses, practitioners, and patients from other applications and systems via REST calls.",Medical
"Siteleaf is a service that allows developers to manage their websites in the cloud. Users can develop their own templates locally or use Siteleaf templates, both of which are built with HTML and Liquid. Websites can be tested locally using the same data as the live sites, and users can invite others to come edit and review their websites. All site data is permanently archived independently from the service. Siteleaf users can access their data for integration with other sites or apps via JSON-RPC API.",Backend
"NativeX is an application creation, management, and backend-as-a-service provider. Users and developers can build, manage, promote, and monetize their applications with NativeX. The NativeX API allows developers to access and integrate the monetization feature of NativeX with other applications. Some example API methods include creating sessions, claiming offers, and redeeming currencies.",Backend
"Nive is a hosting platform and publishing environment for web applications. Easily integrate development components as web services with just a few clicks. Services include user account management, access permissions, website cms, and more. Nive offers a number of API functions for access to Nive services. API functions can be called as http request directly or by using the javascript library. Responses are returned in JSON. API functions include DataStorage, Useraccoutns, Website cms, and HTML application.",Backend
"Illiri is a technical service that connects two or more devices or platforms (mobile, web, radio, TV, etc.) together. The Illiri API allows developers to access and integrate the functionality of Illiri with other applications and to create new applications. Some example API methods include connecting devices, starting and managing sessions, and managing account information.",Internet of Things
"Minutely by Ourcast is a weather application. Minutely aims to provide weather information in real-time, minute by minute. Users can customize their Minutely app by locations and types of weather. The Minutely API allows developers to access and integrate the functionality of Minutely with other applications. Public documentation is not available; interested developers should contact info@ourcast.com for API access.",Weather
"Doorkeeper is an event promotion service that helps promoters build a network of participants called a community. Invites for future events can be sent instantly to everyone in a community, and upcoming events automatically appear on community members' calendars. Should a promoter decide to switch services, they can easily export community members' information and take it with them. When an event is created, Doorkeeper can share its information with other event listing sites. Instead of just getting a count of people who say they're coming, promoters can choose to charge in advance for events and then check participants in using a ticket scanning app. They can also send reminders to people who signed up for an event in advance to make sure they turn up. The Doorkeeper API allows users to retrieve all of the events listed on Doorkeeper or the events for a given community. The Doorkeeper website and API documentation are offered in both English and Japanese.",Events
"MiamiBeachAPI.com is a service of the Miami Beach Visitor and Convention Authority (VCA) that delivers information on Miami Beach businesses and events. The site is powered by a RESTful API, through which the VCA exposes this information. The free API requires no signup and supports browsing and searching of events and businesses by category. Responses are JSON formatted.",Events
"GigaTools allows artists, bands, labels, and agents to manage and promote future gigs online. Musicians can integrate their performance schedules with sites like Facebook, Twitter, Soundcloud, and Mixcloud as well as their own blogs or websites. Labels and agents can use GigaTools to manage all of their artists' schedules from one place, keeping information up-to-date across all personal sites and social networks. The GigaTools API allows users to retrieve data on upcoming gigs from the GigaTools website. Users can search for gigs by location, venue, date range, or the artist's Soundcloud or Twitter ID.",Events
"Nimbus Phantom is a service that simplifies the management of on-demand resources across multiple infrastructure clouds. Phantom monitors available resources and automatically provisions and configures new ones as needed to counteract failures and cater to increased demand. It can be used to supplement local resources with cloud resources or to deploy virtual machines across multiple clouds. Nimbus Phantom is currently being used with Openstack, AWS EC2, and Nimbus clouds, but it is capable of working with any infrastructure cloud supported by Apache Libcloud. Phantom's functions can be accessed programmatically using REST calls issued in JSON.",Backend
"Algorithms.io is a cloud service using machine learning algorithms to deliver predictive analytics to businesses of all sizes. Customers simply upload data, select and run an algorithm, and receive a JSON formatted response. Algorithms.io exposes this workflow through a REST API that allows developers to embed algorithms into their applications. The API supports HTTP GET/POST/DELETE calls allowing applications to manage datasets, jobs, and account balances.",Backend
"Tiramazoo.com is a German product delivery service built for ecommerce. Tiramazoo.com offers both direct integration through a plugin and a REST API. The API is capable of creating or cancelling orders, and delivering service area information. The API communicates over SSL, authenticates with an API token, and returns JSON formatted data.",Shipping
"evvnt is an online event marketing service that broadcasts and publishes events to multiple event listing sites including Facebook, TimeOut, and Eventbrite. evvnt allows you to save time and reach thousands of unique event consumers locally, regionally and nationally. evvnt offers 2 RESTful APIs. The read API allows you to pull events from evvnt for publication on your own site. The write API can be used in conjunction with the read API to submit events to evvnt. Both use JSON over HTTPS and require an API key.",Events
"Built to support the modern application development lifecycle, Runscope is a suite of developer tools allowing users to debug, test and share HTTP or REST API calls. The Runscope API provides developers with programmatic access to data in their Runscope accounts. The API accepts requests sent over HTTPS, returns JSON formatted data, and supports OAuth2 authentication.",Backend
"InsynQ provides businesses with cloud-based hosting for their apps. It was one of the first cloud computing companies formed and currently hosts more than 300 applications. One of InsynQ's services is SSIT (Self Serve IT), which manages account information about users, applications, billing, and subscriptions. SSIT is remotely accessible via API, but the details on this API are not currently public.",Backend
"The Royal Mail Price API allows users to make REST calls that specify an item, the weight of the item and the type of service, and receive the postage cost as a response formatted in JSON. No account is required with service and the service is available for free for commercial and non-commercial use.",Shipping
"Sense Tecnic is a software company that develops technologies for the Internet of Things (IoT). WoTkit is Sense Tecnic's web centric sensing platform that makes it easy to connect real-world objects to the Internet. The system serves as a sensor data aggregator, remote control, dashboard and data processing tool. Sense Tecnic provides a RESTful API for WoTkit that allows developers to connect to and use real world sensor data in their own applications. Example API methods include sensors, sensor subscriptions, sensor fields, and sensor data. The API uses both Keys with basic authentication and Applications with OAuth2 authorization to control access to user's sensors and their data.",Internet of Things
"The Health Insurance Marketplace at HeathCare.gov provides information on health care and health insurance options in the United States. Starting October 1, 2013, users will be able to fill out applications and view a custom list of health care plan options. From there, users will be able to compare plans and select the best one for them. Meanwhile, there is still plenty of healthcare and insurance information available. All of the Health Insurance Marketplace's educational content is available programmatically via API so that developers can use it to create new products and services. The API uses REST calls issued in JSON and JSONP.",Medical
"Dataplug is a cloud shipping system built to allow users to manage all their transport carriers in a single place. The Dataplug API provides a RESTful interface for automating transactions. Specifically, the API can generate orders, retrieve order information, and track orders. Data is sent and received in XML format.",Shipping
"The TrainingFinder Real-time Affiliate Integrated Network (TRAIN) is a free service for public health professionals provided by the Public Health Foundation (PHF). TRAIN website users can find and register for courses, earn continuing education units (CEUs), track their online learning with personal transcripts, discuss and review courses, and get notifications on the latest training available for a specified location or area of expertise. The TRAIN system can be integrated with external learning management systems (LMSs) using SOAP-based APIs.",Medical
"OpenLabels is a free database of labels that app-makers can use instead of coding the same labels over and over. Examples of labels in the database include firstname, lastname, address, email address, user name, password, invalid password, etc. OpenLabels' database contents can be queried, updated, and downloaded using REST calls issued in HTML, XML, or JSON format.",Backend
"Cigna is a health services company that provides integrated health care and related plans as an insurance provider. The Cigna Health API allows the user to access real-time health data. The service allows users to access health data to better serve customers, create applications with personalized data, share test applications, and deploy applications to production. The API uses REST calls and returns XML or JSON.",Medical
"MagnusHealth provides a web-based student medical record management service that aims to provide schools with the capability to reduce liability, save time and money, remain current on regulatory standards, and improve emergency preparedness. The MagnusHealth API provides methods to create new users, secure access tokens, get membership statuses, and other methods. An account is required with service.",Medical
"Pixate is an application building platform. Pixate allows developers to create, build, and manage applications for mobile, web, and desktop. The Pixate API allows developers to access and integrate the functionality of Pixate with other applications and to create new applications. Some example API methods include creating features for applications, styling applications, and managing applications.",Backend
"Webinos is a service funded by the European Union (EU) to build and deliver web, mobile, TV, car, and cross-platform applications. Webinos offers tools and features for developers to build and manage applications. The Webinos API allows developers to access and integrate the functionality of Webinos with other applications and to create new applications. Some example API methods include authenticating applications, adding features to applications, and managing applications.",Backend
UpCloud is a european based Infrastructure-as-a-service company that provides server deployment and bills based on hours of use. The UpCloud API enables users to perform server resource management programmatically communicating with the UpCloud Control Panel or through a mobile application. The API allows users to automate server resource management. An account is required with service and detailed API documentation is available with login to the user control panel or through a site search.,Backend
"Medical Bridge Network (yi-qiao) is an interactive communication and information platform designed to help medical professionals share and discuss scientific information and new medical techniques. Medical Bridge Network provides users with the opportunity to participate in academic exchanges such as real-time meetings and case discussions online. It also offers information resources like treatment guidelines, prescription information, and instructive videos. The Message API allows users to interact programmatically with the Medical Bridge Network website's messaging service. The website is provided solely in Chinese, while the API documentation is given partially in English.",Medical
"Open mHealth is an open architecture software service that enables sharing of mobile health data from various and multiple data sources. The Open mHealth API allows developers to access and integrate the data and functionality of Open mHealth with other applications and to create new applications. Some example API methods include retrieving data from specified streams, posting data, and searching data.",Medical
"Universal Traffic Service Carrier provides supply chain management services associated with delivering freight, parcels, and the like. Their Rate Service API allows users to estimate the shipping rates for goods based on their weight, size, and stackability. It also accounts for the origin and destination points of shipments and whether they contain hazardous materials. This service is available using SOAP calls issued in XML format.",Shipping
OOcharts is a service that allows developers to retrieve Google Analytics data in a simple way. The service queues requests that would normally exceed the Google Analytics API limits to ensure that data is delivered fast and reliably. Use the OOcharts API to fetch data for a given Google Analytics profile. Authentication is via API key. API Keys can give access to one or more Google Profiles. Data can be returned in both JSON and JSONP format.,Analytics
"The Surveillance, Epidemiology and End Results (SEER) Program, a service of the National Cancer Institute, is a cancer statistics resource. Collected data includes information on the incidence, prevalence and survival from specific geographic areas within the U.S., as well as cancer mortality for the entire country. The SEER API is a RESTful service supporting various program datasets and algorithms, and is available to developers who wish to incorporate SEER resources into their own systems. Exposed resources include Collaborative Staging, the Hematopoietic and Lymphoid Neoplasm Database, NAACCR documentation, the Antineoplastic Drugs Database, and incidence site recode variables. The API returns JSON formatted responses, communicates over HTTPS, and requires a free account and API key.",Medical
"How are you? is a free service for NHS patients and healthcare professionals that provides a convenient way to host patient health records online. Patients can control the contents of these records as well as how much of that content is shared and with whom. How are you? also provides users with information about medical conditions in plain English with direct links to external reference sources. The How are you? API uses REST calls to enable users to retrieve, edit, and delete information on the medical conditions, medications, and allergies in a patient's record. The API also lets users add and retrieve measurements taken over time such as blood pressure, blood glucose level, caloric intake, height, weight, and physical exercise.",Medical
"Orchestrate.io is a service that allows users to add features to applications without having to use databases. Orchestrate.io allows people to add features like location services, activity feeds, and recommendations to applications. The Orchestrate.io API allows developers to access and integrate features from Orchestrate.io with other applications and to create new applications. Public documentation is not available; interested developers should email hello@orchestrate.io for more information.",Backend
"Ember is a platform that allows users to build and manage web applications. Ember is open source and free to use. The Ember API allows developers to access and integrate the functionality of Ember with other applications and to create new applications. Some example API methods include managing account information, retrieving information, and managing applications.",Backend
"AnyPresence is a backend-as-a-service (BAAS) to create, develop, and manage mobile applications. AnyPresence allows developers to create applications and add and manage application features. The AnyPresence API allows developers to access and integrate the functionality of AnyPresence with other applications and to create new applications. Public documentation is not available; interested developers should email info@anypresence.com for more information.",Backend
EasyCron is a tool for scheduling calls to specified URLs by time or time interval. Registered users can manage jobs and set them according to their own timezone. Premium users can also receive email notifications about a job's execution and view execution logs for each job. The EasyCron API allows users to manage their jobs without having to log in to the EasyCron website. The API takes RESTful calls and responds in JSON format.,Backend
"Xively is a Platform as a Service (PaaS) for the Internet of Things, which refers to the virtual representations of real-world objects and the connections between them. The platform is designed to make it easier to connect devices, data, people, and places. To this end, it provides messaging, data archiving, provisioning, and directory services. These functions are all accessible programmatically through the Xively API.",Backend
"Validic helps healthcare businesses connect with dozens of mobile health applicationsapps such as Fitbit, RunKeeper, MapMyRide, and iHealthand offer them to their users. When end-users enter data into an app, that data gets sent to the healthcare business's system. This allows the business to collect useful information from their customers and improve their healthcare services without incurring the cost of developing and maintaining their own system of app connections. Integration with Validic is accomplished using its RESTful API.",Medical
"Zubhium is an application management platform, supporting Android beta distribution, reporting and support, user management, analytics, and more. The Zubhium API provides a developer interface for uploading Android .apk files. The API supports simple HTTP POST calls and requires an API Key.",Backend
"The Arizona National Livestock Show (ANLS) website provides information about the show and its events to the general public. The ANLS seeks to preserve western heritage while promoting livestock and agricultural practices. Users can retrieve information on ANLS events, history, and sponsors programmatically via SOAP API.",Events
"SciBite is a drug discovery search engine that continuously scans the internet for new drug-related information. It helps users find new drugs and drug data by tracking the latest news, clinical trials, grants, and blogs relating to pharmaceutical and biotechnology developments. The SciBite API provides programmatic access to its drug discovery data so that other entities can make use of it, and so that informaticians can find new connections within the data.",Medical
"Backendless is a cloud backend platform that enables developers to create apps without server coding by utilizing programmable services which supply standard server functions. The following supported features are user management, relational data, push notifications, publish/subscribe messaging, geolocation, video/audio recording and live streaming on the server, file service. The functions and services are available through the API. Company published SDKs for all popular environments: iOS, Android, JavaScript, ActionScript, Windows Phone and REST. Some API features are app versioning support, video recording and live streaming on the server, filtering for publish/subscribe messages, hosting of websites and apps, flex/air clients support.",Backend
"ticcats is a German-language website for finding events and tickets in Europe, with a focus on Germany, Austria, Switzerland, France, and the UK. It has one of the biggest event databases in Europe, which has been made accessible via API to allow other developers to use it in their applications. Those with existing event databases can use ticcats to supplement them with additional ticket price comparison data. The ticcats API is accessible via REST calls issued in JSON format.",Events
"THIL is a hosted intelligence layer that hosts scripts offline until they are scheduled to be used. When the scripts are called, THIL runs them and puts them away again. Rather than paying to keep a dedicated server running at all times, users can just pay for the milliseconds during which their scripts are actually running. THIL is available at all times and can be accessed programmatically via REST API.",Backend
"Appery.io is a mobile application building and management platform. Users can use Appery.io to build, manage, and cloud host their mobile applications. The Appery.io API allows developers to access and integrate the functionality of Appery.io to build and create applications. Some example API methods include building applications, pushing data, and managing account information.",Backend
ShoutEm provides mobile app development software. The ShoutEm API provides a RESTful interface for developers to interact with content stored on ShoutEm. API responses are JSON formatted.,Backend
Tito is an event ticket sales management applications. Event planners and managers can use Tito to manage ticket sales for their events. The Tito API allows developers to access and integrate the functionality of Tito with other applications. Public documentation is not available; interested developers should contact support@tito.io for more information.,Events
