Service Description,Service Classification
"The Heroku Connect API is an application development platform, and is used to exchange data between a Salesforce organization and a Heroku Postgres database. It can be used to sync accounts, and custom objects from Salesforce. This REST API responds in JSON format, and uses OAuth version 2.0 for authentication. Salesforce is based in San Francisco, and develops CRM software.",Application Development
"Priava offers venue & event management services in the cloud. The Priava API allows developer access to the platform for integrating into third-party applications. API methods include query for venues, event types, create and get contacts, opportunities, or event sources and more.",Events
"With the BaasBox API, developers can integrate backend solutions to mobile applications. The open source interface provides JSON and REST formats accessible with an Api Key. Additional resources include console, plugin engine, and user cases. BaasBox offers backend services for mobile applications.",Backend
"The Picatic API gives users tools to sell tickets online, directly from your app or website. The Picatic API also provides the ability to quickly create new events, list events on your own website, create links to purchase tickets online, retrieve and store data from events, automatically add registrants to a CRM, send triggered emails based on actions, view attendee, order and survey information, and more. With this API, users get real-time access to reporting data and can create personalized reports. Picatic is a ticketing platform with a unique approach to let promoters create event pages to generate funding before events are booked.",Events
"The MOCA API offers a variety of services which can be accessed via MOCA's SDKs. The API can be used to automate beacon fleet management, connect your CRM data, schedule proximity campaigns, and query analytics reports. The MOCA API allows developers to access MOCA is raw data for custom analytics and analysis. MOCA is a context-aware platform that uses big data solutions to get in-depth data analysis on users' behavior. It helps companies to make real-time data-driven decisions. This is a private API but developers can access to documentation by signing up for free trial here https://console.mocaplatform.com/signup.",Analytics
"The Bit6 Backend API adds a communications oriented platform to existing applications. The Backend API is used to implement a developer's application server with Bit6. This REST API responds in JSON format and uses OAuth2. Bit6 is based in Houston, and develops communications integration modules.",Backend
"The Bit6 App API adds a communications oriented platform to existing applications. The App API is used for client and server communications (SDKs). This REST API responds in JSON format, and uses OAuth2. Bit6 is based in Houston, and develops communications integration modules.",Backend
"The Bit6 Authentication API adds a communications oriented platform to existing applications. The Authentication API provides several authorization methods including password, OAuth2, and phone number. This REST API responds in JSON format. Bit6 is based in Houston, and develops communications integration modules.",Backend
"figo.io is the first Banking-as-a-Service in Europe. It enables access to every financial services provider through one API. With the figo Banking API developers can integrate the access to a bank account, the history of transactions, and the submission of payments. Authentication is available via OAuth2. Formats in JSON and REST allow to request and receive responses to retrieve bank accounts, modify bank accounts, and remove a PIN number from the server.",Banking
"The InterPlanetary File System API allows developers to programmatically access all of the methods available through its command line interface. The InterPlanetary File System (IPFS) is a peer-to-peer hypermedia distribution protocol that enables the creation of completely distributed applications. It is composed of a distributed hashtable, an incentivized block exchange, and a self-certifying namespace.",Application Development
The Mendix Single Sign-On API allows developers to integrate their application with the Mendix Single Sign-On Server. The Mendix Single Sign-On system is based on the OpenID 2.0 protocol. Mendix is an application development service.,Application Development
"The Mendix Deploy API allows developers to manage their application environments in the Mendix's public cloud. With this API, developers will be able to deploy and transport new model versions to application environments. Developers will need the Build API to create and manage deployment packages. Mendix is an application development service.",Application Development
"The Mendix Feedback API allows developers to retrieve, add and manage feedback for their Mendix projects. Mendix is an application development service.",Application Development
"The Mendix User Management API allows developers to integrate their applications with the Mendix platform, allowing their clients to create and manage user accounts in their companies. Mendix is an application development service.",Application Development
"The Mendix Team Server API allows developers to retrieve the information (branches, revisions) of application models stored in the Mendix's public cloud. With this API, developers will have access to an application model via the context of an application. Mendix is an application development service.",Application Development
"The Euclid API allows to integrate analytics features into location applications. Useful for marketing projects, Euclid offers Metrics to count visits, measure time at a particular location, predict opportunities, and calculate number of transactions. Requests and responses can be sent and received via JSON. Developers can access the API via token.",Analytics
"EventDay API provides developers with the tools for managing and manipulating event data for streaming through the EventDay platform. The provider, EventDay, creates proprietary platforms that are used in the integratation of event management applications. The API is events service portal offers access to a portfolio of event management tools and returns detailed event-specific information. Its access requests are limited to the permissions of the authorized API keys. The EventDay API is a well-documented and fully-supported release.",Events
"The WorldWide Parcel Services API offers a shipping system to integrate with existing applications. Access to shipment's booking and tracking is available. This API requires an account prior to using its features. WorldWide Parcel Services is a global tracking and delivery company which sends packages to over 200 countries, and it is based in the U.K.",Shipping
"Postmen simplifies submitting data to carriers by consolidating all shipping APIs into one single API. The Postmen API offers a free shipping system to integrate with existing applications. It features rates, labels, and manifests APIs for both domestic and international shipping. The Postmen API is REST based, responds in the JSON format, and supports all shipping carriers.",Shipping
"The Arrow Intelligent Services API provides a single, normalized interface for complex proprietary hardware. The API simplifies and standardizes interactions between hardware, software, and networking elements, making it easier to connect devices to the Internet of Things. The API is represented using Swagger, a JSON standard schema that gives users all the information they need about each individual call. Arrow Intelligent Services is a framework that uses and API-first approach to suppliers, enterprise and developers of the Internet of Things.",Internet of Things
"The GO!AppZone API is a powerful platform that can help developers rapidly create and deploy engaging and functional cross-platform mobile apps for any audience C employees, partners and customers. With its drag-and-drop, configuration-based approach to development, the need to write code is minimized. Using the GO!AppZone, API allows for building apps that integrate and synchronize with back-end systems, working offline, or accessing underlying device hardware. The GO!AppZone platform can also be easily extended with native code plugins and custom integration connectors. Manage files, create push notifications, work with variables, create forms and more with the API.",Application Development
"The Infinario API provides an analytics platform for freemium games to integrate with existing applications. It offers features such as real time statistics, and scenario builder. Identify players, track player events, and more with the API. This REST API responds in JSON format, and requests require HTTP basic authentication. Infinario is a company based in Slovakia which provides tools to obtain value from game data.",Analytics
"The RhoConnect API allows developers to control, monitor, and debug a running RhoConnect application. RhoConnect is an app integration and data syncing service that allows developers to integrate and synchronize data into their applications for offline access. RhoConnect is based on Redis, a NoSQL data cache. It's available in the cloud, or it can be hosted by the user.",Application Development
"The Angus.ai API makes it easy for developers to give senses to machines. Angus.ai embraces AI technologies for text, voice, sound, image, video, text, laser, sonar, and accelerometers that are ready for lightweight setup in the cloud or on devices tuned for noisy-changing contexts. The Angus.ai API has many unique SDKs associated with it and is flexible about where to host data.",Internet of Things
QuantConnect's REST API (v 1.0) aims to increment versions with routing or JSON variable mapping changes. The API allows developers to map out the endpoints and JSON is used to perform basic processes in QuantConnect via a REST API. Requests are rate limited to one request every 3 seconds. QuantConnect is a financial data algorithm platform.,Stocks
"Count.ly provides an API with HTTP format, a RESTful interface, and JSON responses to interact with its mobile analytics software. Count.ly is a mobile application analytics service that offers push notifications, crash reports, user profiles, attribution tracking, and segmentation. The API can be used for marketing, games, and internet of things implementations, just to mention a few options. Count.ly ia available as open source, SaaS edition, and Enterprise edition.",Analytics
The Appstax API provides a scalable backend that incorporates different services such as hosting and signup code. This REST API responds in JSON format. Developers need to be familiar with Appstax's Command Line Interface tool and with the Admin Web UI. Appstax lets developers define their own data model.,Backend
"The Scriptr.io API brings developers a wealth of tools in back-end services. Scriptr.io is a Cloud platform for implementing secure, scalable and reliable Internet of Things applications, through server-side JavaScript scripts and provides developers and development teams with a wide range of tools (web IDE, integration with code repositories) and APIs. Scriptr.io further simplifies the development of IoT apps and reduces their time to market by providing you with connectors to many third party devices (Nest, Withings, Fitbit, Carvoyant, etc.) and services, which are seamlessly used as first class objects in your scripts.",Internet of Things
"The Mondo Web hooks API is an API that allows developers to incorporate real-time, push notifications of events occuring within an account, into their application. The Mondo API allows interaction with users' banking accounts including transaction listing and retrieval. The API is currently in beta so interested developers should get in touch via the Mondo Twitter account. Mondo is a mobile-first bank and banking application.",Banking
The Mondo REST API is a banking API that allows interaction with users' accounts. Interactions include listing and retrieving transactions. The API is currently in beta so interested developers should get in touch via the Mondo Twitter account. Mondo is a mobile-first bank and banking application.,Banking
"With the Adlegant Article Analysis API, developers can extract article features such as title, text, summary, main image, keywords, and entities from a given URL. Available in JSON format responses and API Key authentication. Adlegant is a service dedicated to convert articles into structured data. It offers article content extraction, text summarization, text classification, sentiment analysis, and language detection.",Analytics
"The kintone REST API allows developers to manage app records, retrieve app descriptions, and manipulate spaces for their custom applications. Kintone is a service that allows developers to create custom business applications for automating business processes using a drag-and-drop interface. Users may also choose from more than 30 pre-built applications in kintone's library.",Application Development
The Ordoro API provides developers a toolkit to build apps that simplify ecommerce back-office operations. The API can also be used by other complimentary service providers to hook up with the Ordoro platform and create stellar apps that solve merchants i needs. Ordoro is a shipping and inventory management software company.,Shipping
"The IBAN Check API lets developers integrate its service with their applications, enabling their users to check if an International Bank Account Number (IBAN) number is valid or invalid. The IBAN numbers are the new standard for bank account numbers in Europe and a few countries outside Europe. Tuxx is a provider of APIs, based in The Netherlands.",Banking
"The adjust KPI Service API allows developers to retrieve statistics on the mobile applications that they track with adjust. Adjust is a business intelligence platform designed for mobile app marketers. It provides information on where the user's customers are coming from, as well as advanced analytics and app store statistics.",Analytics
"Xamarin Unified API allows to share code between Mac and iOS systems, targeting apps of 32 bit and 64 bit. Available formats include JSON, REST, SOAP, and XML. Api Key is the authentication method. Xamarin specializes in mobile app development. Additional company services include Xamarin Test Cloud, Xamarin Insights, and Xamarin University.",Backend
"The SendCloud API allows developers to programmatically access shipping services for their online shops. SendCloud can automatically generate shipping labels, send personalized Track & Trace emails, pay postage, and more. SendCloud's services have been optimized for ecommerce. The SendCloud website is provided in Dutch, but the API documentation is in English.",Shipping
"qx.Desktop API provides developers a way to build rich and interactive, desktop-like applications. . Qooxdoo is a universal JavaScript framework, and is owned and managed by 1&1, a web host company.",Application Development
"The Stackify API allows users to access their errors, logs, and metrics programmatically. Stackify is an integrated monitoring solution for servers, app metrics, and app performance. It monitors key metrics and performance indicators and sends users alerts when new errors or high error rates occur. Users can view all of their application logs together in order to troubleshoot problems quickly.",Application Development
The littleBits Cloud API allows developers to connect their littleBits devices to the internet. LittleBits sells sets of tiny electrical modules that users can snap together to easily create and prototype electronic devices. These modules can be used by educators to teach students about electrical systems or by DIYers for prototyping their ideas.,Internet of Things
"Neura is an Internet of Things service that aims to improve engagement with users' communication and increase security with home automation. API/SDK documentation is available to build apps with OAuth2. The purpose of Neura's resources keep applications and devices connected to a user's activities. With the API, developers can study how to request health and wellness information, subscribe to a push notification, and authenticate a user. More about how the RESTful API returns JSON responses in the health and wellness example here: https://github.com/NeuraLabs/Neura_documentation/blob/master/text/quickstartPull.md",Internet of Things
"Sentdex specializes in the analysis of finance, politics, and geographical data. The company's slogan is: Qualifying the Quantitative, offering sentiment analysis technology to try to predict results, without the guaranty to take it as an investment advice. The API offers financial trading signals and raw data from the stock sentiment analysis database. Contact the founder Harrison@sentdex.com for customized solutions.",Analytics
"Zatar is an Internet of Things cloud based service, designed to ease collaboration and application development. The API affords to create apps with customized experiences such as virtual world and avatars. One of the main goals of Zatar, part of Zebra Technologies, is to empower business operations to the next level.",Application Development
"The Apixu API provides weather data for developing weather apps. The RESTful API uses JSON over HTTP for requests/returns and requires an API Key for authentication. Apixu offers data for real-time weather, 10 day weather forecast, astronomy, time zone, and location. A few of the available methods include: maximum and minimum temperature, wind speed, sun and moon rise/set, and feels like temperatures. See the API documentation for full method descriptions and information on how to get started developing with Apixu.",Weather
"The Domino API lets developers integrate their applications with the Domino services, enabling their users to automate analyses and reports, deploy and scale their infrastructure. This API is REST based, and an API key is required to make API requests. Domino provides businesses a way to automate and perform analysis.",Analytics
"The Localytics Query REST API allows developers to access and integrate the functionality of Localytics with other applications. Some example API methods include searching for users, retrieving user activities, and retrieving event information. Localytics is a marketing and analytics platform for web and mobile applications. Some features of Localytics include engagement analysis, segmentation, and acquisition management.",Analytics
"The Attendify event API allows you to build custom apps for your event or conference. The API accepts XML or JSON data formats and supports HTTP Basic Auth for authentication. Use Attendify to add event schedules, speaker bios, maps, news, and more to your event app. To get started, sign up for a free Attendify account to access the Developer's Dashboard. See the API docs for detailed information on methods and schema descriptions.",Events
"The ThingPark REST API allows developers to access and integrate the functionality of ThingPark with other applications. Public documentation is not available; API access comes with account service. ThingPark by Actility is a cloud platform for long-range internet-of-things (IoT), applications, and wi-fi capability.",Internet of Things
"The LaunchDarkly REST API allows developers to access and integrate the functionality of LaunchDarkly with other applications. Some example API methods include integrating features in applications, managing user accounts, and managing application goals. The documentation also allows for API testing. LaunchDarkly also offers multiple SDKs in a variety of languages. LaunchDarkly is an application feature management and deployment platform.",Application Development
The Doorman REST API allows developers to access and integrate the functionality of Doorman with other applications. Public documentation is not available; interested developers should contact Doorman for more information: http://www.doorman.co/#partner. Doorman is on-demand package delivery provider so users do not miss package deliveries.,Shipping
"Docker Hub is an open application development platform for sharing apps and repositories, and automating workflows. The Docker Hub API uses HTTP Basic Auth over SSL and JSON for PUT/DELETE requests and returns. In conjunction with Docker Engine, a lightweight runtime tool, Docker Hub facilitates the development of portable apps that can be built with any toolchain and used on any machine. Use the RESTful API to create repositories, manage repository libraries, and update repository library images.",Application Development
"Docker is a open application development platform for sharing apps and repositories and automating development workflows. Use the Docker Remote API to access Docker API features like creating a container, searching images, retrieving container logs, or building an image from a Dockerfile. This mostly RESTful API uses JSON for requests/returns and GET/POST methods over HTTP. The Remote API is currently in version 1.18. See the project home page for more detailed information on available API methods.",Application Development
"Docker is a cloud-based application development platform for building distributed apps, sharing repositories, and automating workflows. Docker Swarm is native clustering for Docker and will turn a pool of Docker hosts into a single, virtual host. Swarm requires Docker 1.4.0 or later and is compatible with Docker Remote API. Developers should note that Swarm is currently in beta and will likely change.",Application Development
"The Docker Registry REST API stores the images and graph for a set of repositories. Registry uses HTTP PUT/GET methods with JSON calls/returns. Docker Registry does not contain any user accounts data, does not have a local database, and supports multiple storage backends. Use the API to retrieve image layers, get image ancestry, or list repository tags.",Application Development
"The Docker Hub Accounts API facilitates Docker user accounts management. The API uses GET/POST methods with JSON over HTTP. Requests are authenticated with either HTTP Basic or OAuth Bearer Token. Use Docker Hub Accounts to update a user and add, list, or delete an email for a user.",Application Development
The ShepHertz App42 Cloud Review/Rating API allows developers to create review and rating on their application item. ShepHertz Technologies is a cloud company that specializes in many aspects of data management.,Application Development
"The ShepHertz App42 Cloud App Analytics API allows developers to measure the number of API calls, to analyze storage consumed by their app, and more. ShepHertz Technologies is a cloud company that specializes in many aspects of data management.",Analytics
"Infermedica is an Artificial Intelligence API for medical diagnosis. Primary use-cases include creating intelligent symptom checkers, adaptive patient intake forms, diagnostic chat bots or building an advanced clinical decision support tools for clinicians. The API allows you to submit anonymized patient health data (such as symptoms, lab tests and risk factors) for diagnostic analysis. Infermedica's intelligent inference engine analyzes the data in real-time and looks for possible diagnoses in a broad medical knowledge base. In the result you receive an assessment of likely conditions and suggestions of relevant symptoms to verify as well as cost-efficient lab tests to order. Infermedica API can be used to create new or enrich existing healthcare products and services with intelligent diagnostic insights.",Medical
"The VIMOC REST API allows developers to access and integrate the functionality of VIMOC with other applications. Some example API methods include retrieving site information, looking up sites, and managing site specifications. VIMOC Technologies is a ubiquitous landscape computing platform that connects the Internet of Things and places.",Internet of Things
"The Meeti REST API allows developers to access and integrate the functionality of Meeti with other applications and smart devices. Some example API methods include connecting devices, managing devices, and managing account information. Meeti by MoBagel is device analytics software service for the Internet of Things and smart devices.",Internet of Things
The Google Container Engine API allows users to develop and manage containers on distributed systems. The Container Engine provides a platform for quickly and easily provisioning resources and managing applications. It is designed to support Kubernetes so that customers can run multiple clouds. The Google Container Engine is still in Alpha and is not recommended for production use.,Application Development
"Katana by NinjaMetrics is a social analytics engine that measures social value of how users influence each other. The Katana Analytics API allows developers to measure the value of social contributions in applications and games. This API also provides developers with detailed projections for the outcomes that matter to developers, and offers the tools to determine how effectively features facilitate engagement and social interaction. Moreover, the API documentation gives developers access to send JSON directly to Katana without using an integration library.",Analytics
This API from KEMP Technologies facilitates remote access to the LoadMaster load balancing application. LoadMaster is RESTful using standard HTTP GET requests with returns in XML. The API authenticates via HTTP Basic Auth. Use LoadMaster to modify Virtual Services or enable/delete Real Servers and more.,Backend
